<?xml version="1.0" encoding="UTF-8"?>
<!DOCTYPE biblioteca SYSTEM "biblioteca.dtd">

<biblioteca>

    <libros>

        <libro id="L1111" tipo_clase="novela" numpag="100">
            <titulolib>ASD</titulolib>
            <indicelib>ASDF</indicelib>
            <sipnosislib>ASD</sipnosislib>
            <capitulos>
                <capitulo titulocap="capitulo 1">
                     <contenido link="www."/>
                </capitulo>
            </capitulos>
        </libro>

        <libro id="L2222" tipo_clase="infantil" numpag="100">
            <titulolib>ASDF</titulolib>
            <indicelib>ASDF</indicelib>
            <sipnosislib>ASF</sipnosislib>
            <capitulos>
            
                <capitulo titulocap="capitulo 1" numpag="10">
                    <contenido link="www."/>
                </capitulo>
            </capitulos>
            
        </libro>

        <libro id="L3333" tipo_clase="didactico"  numpag="10">
            <titulolib></titulolib>
            <indicelib></indicelib>
            <sipnosislib></sipnosislib>
            <capitulos> 
                <capitulo titulocap="capitulo 1"  numpag="10">
                     <contenido link="www."/>
                </capitulo>
            </capitulos>
            
        </libro>
    
    </libros>

    <periodicos> 

        <periodico id="P1234" tipo_clase="nacionales" fecha_pub="25/02/97">
            <seccionP tiposec="econÃ³mica">
                <articulo autor="Rdero">
                    <contenido link="ww.aaa.com" />
                </articulo>
            
            </seccionP>
            <indice>Indice 1</indice>
        
        
        
        
         </periodico>
   
    </periodicos>

    <revistas>
      
        <revista id="R1111" tipo_clase="informatica" numpag="100">
            <titulorev>Revista 1</titulorev>
            <numrev>113</numrev>
            <indicerev>Indice1 </indicerev>
            <seccionesrev>
                <seccion numpag="10">
                <contenidorev link="www.contenido.es" />
                </seccion>
            </seccionesrev>
        
        </revista>     

        
    </revistas>



</biblioteca>